StudyID,Title,DOI,doi_key,Publisher,Abstract_Normalized
85,Tetris: A Compilation Framework for VQA Applications in Quantum Computing,10.1109/isca59077.2024.00029,,IEEE,quantum computing has shown promise in solving complex problems by leveraging the principles of superposition and entanglement variational quantum algorithms vqa are a class of algorithms suited for nearterm quantum computers due to their modest requirements of qubits and depths of computation this paper introduces tetris – a compilation framework for vqa applications on nearterm quantum devices tetris focuses on reducing twoqubit gates in the compilation process since a twoqubit gate has an order of magnitude more significant error and execution time than a singlequbit gate tetris exploits unique opportunities in the circuit synthesis stage often overlooked by the stateoftheart vqa compilers for reducing the number of twoqubit gates tetris comes with a refined ir of pauli string to express such a twoqubit gate optimization opportunity moreover tetris is equipped with a fast bridging approach that mitigates the hardware mapping cost overall tetris demonstrates a reduction of up to in cnot gate counts in circuit depth and in circuit duration for various molecules of different sizes and structures compared with the stateoftheart approaches tetris is opensourced at this link
86,The Arrow Calculus as a Quantum Programming Language,10.1007/978-3-642-02261-6_30,,Springer-Verlag,we express quantum computations with measurements using the arrow calculus extended with monadic constructions this framework expresses quantum programming using wellunderstood and familiar classical patterns for programming in the presence of computational effects in addition the five laws of the arrow calculus provide a convenient framework for equational reasoning about quantum computations that include measurements
88,Toolchain for faster iterations in quantum software development,10.1007/s00607-025-01450-x,,Springer-Verlag,quantum computing proposes a revolutionary paradigm that can radically transform numerous scientific and industrial application domains to realize this promise these new capabilities need software solutions that are able to effectively harness its power however developers may face significant challenges when developing and executing quantum software due to the limited availability of quantum computer hardware high computational demands of simulating quantum computers on classical systems and complicated technology stack to enable currently available accelerators into development environments these limitations make it difficult for the developer to create an efficient workflow for quantum software development in this paper we investigate the potential of using remote computational capabilities in an efficient manner to improve the workflow of quantum software developers by lowering the barrier of moving between local execution and computationally more efficient remote hardware and offering speedup in execution with simulator surroundings the goal is to allow the development of more complex circuits and to support an iterative software development approach in our experiment with the solution presented in this paper we have obtained up to 5 times faster circuit execution runtime and enabled qubit ranges from 21 to 29 qubits with a simple plugandplay kernel for the jupyter notebook
89,Towards a user-centric HPC-QC environment,10.1145/3731599.3767549,,ACM,robust execution environments are important for addressing key challenges in quantum computing such as application development portability and reproducibility and help unlock the development of modular quantum programs driving forward hybrid quantum workflows in this work we show progress towards a basic but portable runtime environment for developing and executing hybrid quantumclassical programs running in high performance computing hpc environments enhanced with quantum processing units qpus the middleware includes a second layer of scheduling after the main hpc resource manager in order to improve the utilization of the qpu and extra functionality for observability monitoring and admin access this approach enables managing multiple programming software development kits sdks as firstclass citizens in the environment by building on a recently proposed vendorneutral quantum resource management interface qrmi lastly we discuss and show a solution for the monitoring and observability stack completing our description of the hybrid system architectureccs concepts• computer systems organization → quantum computing heterogeneous hybrid systems
91,Towards Quantum-algorithms-as-a-service,10.1145/3549036.3562056,,ACM,quantum computing is an emerging field of high interest many companies have started to work on developing more powerful and stable quantum computers however developers still struggle to master the art of programming with a quantum computer one of the major challenges faced is the integration of quantum parts of a system with the classical one this paper proposes a novel development model called quantumalgorithmsasaservice qaaas this new model aims to allow developers to abstract the quantum components away from the design of the software they are building the model leverages softwareasaservice and functionasaservice to support multiple quantum cloud providers and run their algorithms regardless of the underlying hardware
92,Trusted Execution Environments for Quantum Computers,10.1145/3658644.3690855,,ACM,the cloudbased environments in which todays and future quantum computers will operate raise concerns about the security and privacy of users intellectual property quantum circuits submitted to cloudbased quantum computer providers represent sensitive or proprietary algorithms developed by users that need protection further input data is hardcoded into the circuits and leakage of the circuits can expose users data although still in the noisy intermediate scale quantum regime quantum computers hold promise to be able to execute novel algorithms and create invaluable data however just as with any other type of computing resource they may be vulnerable to security attacks and should have defenses built into their hardware and software design in classical computing a trusted execution environment tee is an area on the main processor of a device that is separated from the systems main operating system which ensures data is stored processed and protected in a secure environment similar to the classical computing by leveraging trusted hardware we propose trusted execution environments for quantum computers the proposed thesis will explore the feasibility and the security of the quantum computer trusted execution environment architecture as a novel security primitive in this prospectus the challenges and approaches are outlined current results are presented to show the feasibility of the proposed work and a timeline of future work is given
